{
  "schemaVersion": "1.0",
  "policyVersion": "2026-09-28.1",
  "cloud": "commercial",
  "canonicalHosts": [
    "api.loganalytics.azure.com",
    "api.security.microsoft.com",
    "graph.microsoft.com",
    "management.azure.com"
  ],
  "redirectPolicy": "manual-reauthorization-required;automatic-follow-disabled;cross-origin-authorization-forwarding-disabled",
  "globalBounds": {
    "maxTimeRangeDays": 31,
    "maxRows": 10000,
    "maxBytes": 10485760,
    "maxRuntimeSeconds": 300,
    "maxWorkspaces": 1,
    "maxSubscriptions": 20,
    "maxBatchRequests": 20
  },
  "allowedTimespanFormats": [
    "start/end"
  ],
  "crossResourceFunctions": [
    "adx",
    "app",
    "arg",
    "cluster",
    "database",
    "externaldata",
    "resource",
    "workspace"
  ],
  "responseAdapterCapabilities": [
    {
      "adapterId": "havoc-protected-store-adapter",
      "adapterVersion": "1.0.0"
    }
  ],
  "capabilityTrust": {
    "maxLifetimeSeconds": 300,
    "maxClockSkewSeconds": 30,
    "issuers": [
      {
        "issuerId": "havoc-adapter-orchestrator",
        "issuerVersion": "1.0.0",
        "keyId": "havoc-capability-hmac-v1"
      }
    ]
  },
  "knownMutationPathPatterns": [
    "^.*(?:/comments?|/sendmail|/revokesigninsessions|/members/\\$ref|/tiindicators|/retire|/wipe|/isolate|/unisolate|/release|/quarantine|/purge|/remediate|/resetpassword|/sharedkeys|/listkeys)(?:/|$|\\?).*$",
    "^.*/informationprotection/threatassessmentrequests(?:/|$|\\?).*$",
    "^.*/security/incidents/[^/]+/(?:update|comments?)(?:/|$|\\?).*$"
  ],
  "conditionalCapabilities": {
    "graphSecurityHunting": {
      "enabled": false,
      "reason": "preview_policy_profile_required"
    },
    "defenderLegacyHunting": {
      "enabled": false,
      "reason": "compatibility_disabled"
    }
  },
  "odata": {
    "builderRequired": true,
    "allowedFields": {
      "status": [
        "string"
      ],
      "severity": [
        "string"
      ],
      "assignedTo": [
        "string"
      ],
      "createdDateTime": [
        "datetime"
      ],
      "activityDateTime": [
        "datetime"
      ],
      "detectedDateTime": [
        "datetime"
      ],
      "userId": [
        "string"
      ],
      "appId": [
        "string"
      ],
      "ipAddress": [
        "string"
      ],
      "riskState": [
        "string"
      ],
      "riskLevel": [
        "string"
      ]
    },
    "allowedOperators": [
      "eq",
      "ne",
      "ge",
      "gt",
      "le",
      "lt"
    ],
    "maxLiteralLength": 128
  },
  "operations": [
    {
      "operationId": "graph-security-incidents-list",
      "host": "graph.microsoft.com",
      "method": "GET",
      "path": "/v1.0/security/incidents",
      "semanticClass": "read",
      "ruleId": "ALLOW-GRAPH-SECURITY-READ",
      "requiredRequestedScopes": [
        "SecurityIncident.Read.All"
      ],
      "requiredTokenPermissions": [
        "SecurityIncident.Read.All"
      ],
      "allowedRequestedScopes": [
        "SecurityIncident.Read.All"
      ],
      "allowedTokenPermissions": [
        "SecurityIncident.Read.All"
      ],
      "allowedQueryKeys": [
        "$count",
        "$filter",
        "$skip",
        "$top",
        "$expand"
      ],
      "retryableTransportExceptions": true,
      "requireTop": true,
      "maxRows": 1000,
      "estimatedBytesPerRow": 1024
    },
    {
      "operationId": "graph-security-alerts-list",
      "host": "graph.microsoft.com",
      "method": "GET",
      "path": "/v1.0/security/alerts_v2",
      "semanticClass": "read",
      "ruleId": "ALLOW-GRAPH-SECURITY-ALERTS-READ",
      "requiredRequestedScopes": [
        "SecurityIncident.Read.All"
      ],
      "requiredTokenPermissions": [
        "SecurityIncident.Read.All"
      ],
      "allowedRequestedScopes": [
        "SecurityIncident.Read.All"
      ],
      "allowedTokenPermissions": [
        "SecurityIncident.Read.All"
      ],
      "allowedQueryKeys": [
        "$count",
        "$filter",
        "$skip",
        "$top"
      ],
      "retryableTransportExceptions": true,
      "requireTop": true,
      "maxRows": 1000,
      "estimatedBytesPerRow": 1024
    },
    {
      "operationId": "graph-security-incident-with-alerts-get",
      "host": "graph.microsoft.com",
      "method": "GET",
      "pathPattern": "^/v1\\.0/security/incidents/[A-Za-z0-9][A-Za-z0-9._:-]{0,127}$",
      "apiVersionPolicy": {
        "location": "path",
        "allowedValues": [
          "v1.0"
        ]
      },
      "semanticClass": "read",
      "safeSemantics": "single_incident_with_documented_alerts_relationship",
      "ruleId": "ALLOW-GRAPH-SECURITY-INCIDENT-DETAIL",
      "requiredRequestedScopes": [
        "SecurityIncident.Read.All"
      ],
      "requiredTokenPermissions": [
        "SecurityIncident.Read.All"
      ],
      "allowedRequestedScopes": [
        "SecurityIncident.Read.All"
      ],
      "allowedTokenPermissions": [
        "SecurityIncident.Read.All"
      ],
      "allowedQueryKeys": [
        "$expand"
      ],
      "retryableTransportExceptions": true,
      "fixedQueryValues": {
        "$expand": [
          "alerts"
        ]
      },
      "requireTop": false,
      "maxRows": 1,
      "estimatedBytesPerRow": 65536
    },
    {
      "operationId": "graph-batch",
      "host": "graph.microsoft.com",
      "method": "POST",
      "path": "/v1.0/$batch",
      "semanticClass": "read_batch",
      "ruleId": "ALLOW-GRAPH-BATCH",
      "requiredRequestedScopes": [
        "SecurityIncident.Read.All"
      ],
      "requiredTokenPermissions": [
        "SecurityIncident.Read.All"
      ],
      "allowedRequestedScopes": [
        "SecurityIncident.Read.All"
      ],
      "allowedTokenPermissions": [
        "SecurityIncident.Read.All"
      ],
      "allowedQueryKeys": [],
      "retryableTransportExceptions": true,
      "bodyValidator": "graphBatch",
      "maxRows": 10000
    },
    {
      "operationId": "log-analytics-query",
      "host": "api.loganalytics.azure.com",
      "method": "POST",
      "pathPattern": "^/v1/workspaces/[0-9a-f]{8}-[0-9a-f]{4}-[1-5][0-9a-f]{3}-[89ab][0-9a-f]{3}-[0-9a-f]{12}/query$",
      "semanticClass": "read_query",
      "ruleId": "ALLOW-LOG-ANALYTICS-QUERY",
      "requiredRequestedScopes": [
        "https://api.loganalytics.io/.default"
      ],
      "requiredTokenPermissions": [
        "user_impersonation"
      ],
      "allowedRequestedScopes": [
        "https://api.loganalytics.io/.default"
      ],
      "allowedTokenPermissions": [
        "user_impersonation"
      ],
      "allowedQueryKeys": [],
      "retryableTransportExceptions": true,
      "allowedBodyProperties": [
        "query",
        "resultLimit",
        "timespan"
      ],
      "bodyValidator": "logAnalyticsQuery",
      "responseEnforcementRequired": true,
      "maxRows": 10000,
      "sourceRefs": [
        "MS-LA-ACCESS",
        "MS-SENTINEL-AUDIT"
      ]
    },
    {
      "operationId": "azure-resource-graph-query",
      "host": "management.azure.com",
      "method": "POST",
      "path": "/providers/Microsoft.ResourceGraph/resources",
      "semanticClass": "read_query",
      "ruleId": "ALLOW-RESOURCE-GRAPH-QUERY",
      "requiredRequestedScopes": [
        "https://management.azure.com/.default"
      ],
      "requiredTokenPermissions": [
        "user_impersonation"
      ],
      "allowedRequestedScopes": [
        "https://management.azure.com/.default"
      ],
      "allowedTokenPermissions": [
        "user_impersonation"
      ],
      "allowedQueryKeys": [
        "api-version"
      ],
      "retryableTransportExceptions": true,
      "allowedApiVersions": [
        "2022-10-01"
      ],
      "allowedBodyProperties": [
        "options",
        "query",
        "resultLimit",
        "subscriptions"
      ],
      "bodyValidator": "resourceGraphQuery",
      "responseEnforcementRequired": true,
      "maxRows": 1000
    },
    {
      "operationId": "purview-audit-query-create",
      "host": "graph.microsoft.com",
      "method": "POST",
      "path": "/v1.0/security/auditLog/queries",
      "semanticClass": "retrieval_job_state",
      "ruleId": "ALLOW-PURVIEW-RETRIEVAL-JOB",
      "requiredRequestedScopes": [],
      "requiredTokenPermissions": [],
      "allowedRequestedScopes": [
        "AuditLogsQuery-Entra.Read.All",
        "AuditLogsQuery-Exchange.Read.All",
        "AuditLogsQuery-OneDrive.Read.All",
        "AuditLogsQuery-SharePoint.Read.All"
      ],
      "allowedTokenPermissions": [
        "AuditLogsQuery-Entra.Read.All",
        "AuditLogsQuery-Exchange.Read.All",
        "AuditLogsQuery-OneDrive.Read.All",
        "AuditLogsQuery-SharePoint.Read.All"
      ],
      "allowedQueryKeys": [],
      "retryableTransportExceptions": false,
      "allowedBodyProperties": [
        "displayName",
        "filterEndDateTime",
        "filterStartDateTime",
        "ipAddressFilters",
        "objectIdFilters",
        "operationFilters",
        "recordTypeFilters",
        "serviceFilter",
        "userPrincipalNameFilters"
      ],
      "bodyValidator": "purviewRetrievalJob",
      "maxRows": 10000,
      "requiredPreconditions": [
        "operationalNecessityVerified",
        "lifecycleVerified",
        "persistenceVerified",
        "visibilitySharingVerified",
        "retentionExpiryVerified",
        "sideEffectsVerified",
        "leastPrivilegeVerified",
        "boundedRequestVerified",
        "commercialEndpointVerified",
        "reportDisclosurePlanned"
      ]
    },
    {
      "operationId": "purview-audit-query-get",
      "host": "graph.microsoft.com",
      "method": "GET",
      "pathPattern": "^/v1\\.0/security/auditLog/queries/[A-Za-z0-9][A-Za-z0-9._:-]{0,127}$",
      "apiVersionPolicy": {
        "location": "path",
        "allowedValues": [
          "v1.0"
        ]
      },
      "semanticClass": "read",
      "safeSemantics": "single_retrieval_job_status_read",